{
  "id": "docs/learn-devitpro/dev-itpro/developer/methods-auto/filterpagebuilder/filterpagebuilder-runmodal-method.md",
  "pillar": "docs",
  "source": "learn-devitpro",
  "tier": "official",
  "title": "FilterPageBuilder.RunModal() Method",
  "url": "https://learn.microsoft.com/dynamics365/business-central/dev-itpro/developer/methods-auto/filterpagebuilder/filterpagebuilder-runmodal-method",
  "published_at": "2026-10-07T12:07:15.000Z",
  "language": "en",
  "state": "fetched",
  "stages": {
    "discovered": {
      "at": "2026-10-06T11:15:53.411Z"
    },
    "fetched": {
      "at": "2026-10-07T18:12:57.064Z",
      "blob": "8ce54fff58a4301511e00aaf561d9330e869e613",
      "words": 253,
      "forms": 0
    }
  },
  "input_hash": "8ce54fff58a4301511e00aaf561d9330e869e613",
  "attempts": 0,
  "flags": [],
  "meta": {
    "repo": "MicrosoftDocs/dynamics365smb-devitpro-pb",
    "path": "dev-itpro/developer/methods-auto/filterpagebuilder/filterpagebuilder-runmodal-method.md",
    "description": "Builds and runs the filter page that includes the filter controls that are stored in FilterPageBuilder object instance.",
    "ms_date": "2026-10-01",
    "ms_topic": "reference",
    "search_form": [],
    "keywords": [],
    "ai_usage": null,
    "words": 253,
    "identifiers": []
  },
  "last_error": null,
  "retry_after": null,
  "output_hash": "8ce54fff58a4301511e00aaf561d9330e869e613"
}
