{
  "id": "docs/learn-devitpro/dev-itpro/developer/analyzers/pertenantextensioncop-pte0021.md",
  "pillar": "docs",
  "source": "learn-devitpro",
  "tier": "official",
  "title": "PerTenantExtensionCop Error PTE0021",
  "url": "https://learn.microsoft.com/dynamics365/business-central/dev-itpro/developer/analyzers/pertenantextensioncop-pte0021",
  "published_at": "2026-10-07T12:07:15.000Z",
  "language": "en",
  "state": "fetched",
  "stages": {
    "discovered": {
      "at": "2026-10-06T11:15:53.411Z"
    },
    "fetched": {
      "at": "2026-10-07T18:12:33.249Z",
      "blob": "c5af2075338cf1300aa2276bf67b1f31a2cb6170",
      "words": 57,
      "forms": 0
    }
  },
  "input_hash": "c5af2075338cf1300aa2276bf67b1f31a2cb6170",
  "attempts": 0,
  "flags": [],
  "meta": {
    "repo": "MicrosoftDocs/dynamics365smb-devitpro-pb",
    "path": "dev-itpro/developer/analyzers/pertenantextensioncop-pte0021.md",
    "description": "The namespace must be different from System and Microsoft.",
    "ms_date": "2026-10-01",
    "ms_topic": "reference",
    "search_form": [],
    "keywords": [],
    "ai_usage": null,
    "words": 57,
    "identifiers": [],
    "identifiers_rule": 2
  },
  "last_error": null,
  "retry_after": null,
  "output_hash": "c5af2075338cf1300aa2276bf67b1f31a2cb6170"
}
