{
  "id": "video/yt-microsoft/sv1utmneaXA",
  "pillar": "video",
  "source": "yt-microsoft",
  "tier": "official",
  "title": "Introducing: Extending Copilot Chat with Your App's Documentation (2025 release wave 2)",
  "url": "https://www.youtube.com/watch?v=sv1utmneaXA",
  "published_at": "2025-10-01T00:00:00Z",
  "language": "en",
  "state": "published",
  "stages": {
    "discovered": {
      "at": "2026-10-06T11:51:47.857Z"
    },
    "fetched": {
      "at": "2026-10-06T11:51:47.857Z",
      "seed": true
    },
    "captioned": {
      "at": "2026-10-06T11:51:47.857Z",
      "path": "data/captions/microsoft/sv1utmneaXA.vtt",
      "vtt_sha256": "5d7683992e80571572f26ef1a211143f6108ad036b539792b942044c0c76f4b3",
      "segments": 36,
      "words": 1496,
      "lang": "en-orig",
      "seed": true,
      "id_via": "filename"
    },
    "extracted": {
      "at": "2026-10-06T18:27:49.172Z",
      "path": "data/extract/video/sv1utmneaXA.json",
      "prompt": "extract-video@1",
      "windows": 1,
      "features": 6,
      "quotes": 7,
      "quotes_dropped": 0,
      "models": [
        "claude-haiku-4-5-20251001"
      ],
      "cost_usd": 0.023434
    },
    "summarized": {
      "at": "2026-10-06T18:27:55.646Z",
      "path": "data/summary/video/sv1utmneaXA.json",
      "prompt": "summarize-video@2",
      "model": "claude-sonnet-5-5",
      "cost_usd": 0.014400399999999999
    },
    "linked": {
      "at": "2026-10-06T18:27:55.648Z",
      "systems": [
        "copilot",
        "development",
        "integration"
      ],
      "topics": 8,
      "objects_as_heard": 2
    },
    "published": {
      "at": "2026-10-06T18:27:55.658Z",
      "path": "content/videos/sv1utmneaXA.md"
    }
  },
  "input_hash": null,
  "attempts": 0,
  "flags": [],
  "meta": {
    "channel_id": "UCLErzd6kpQ0DAJSGsGjtxbA",
    "seed_file": "2025-10-01 - BCLE - Introducing： Extending Copilot Chat with Your App's Documentation (2025 release wave 2) [sv1utmneaXA].vtt"
  },
  "last_error": null,
  "retry_after": null,
  "output_hash": "a211a270f3404a938251f1dfa7c5e6e508acf434896f5bcf2ab596ed5902ef32"
}
