{
  "id": "docs/learn-devitpro/dev-itpro/developer/diagnostics/diagnostic-al808.md",
  "pillar": "docs",
  "source": "learn-devitpro",
  "tier": "official",
  "title": "Compiler Error AL0808",
  "url": "https://learn.microsoft.com/dynamics365/business-central/dev-itpro/developer/diagnostics/diagnostic-al808",
  "published_at": "2026-10-07T12:07:15.000Z",
  "language": "en",
  "state": "fetched",
  "stages": {
    "discovered": {
      "at": "2026-10-06T11:15:53.411Z"
    },
    "fetched": {
      "at": "2026-10-07T18:12:46.304Z",
      "blob": "42f5ff4acde42635fa1c86ed18de556807e4986d",
      "words": 75,
      "forms": 0
    }
  },
  "input_hash": "42f5ff4acde42635fa1c86ed18de556807e4986d",
  "attempts": 0,
  "flags": [],
  "meta": {
    "repo": "MicrosoftDocs/dynamics365smb-devitpro-pb",
    "path": "dev-itpro/developer/diagnostics/diagnostic-al808.md",
    "description": "You cannot set the '{0}' property to '{1}' for {2} '{3}' in the page customization '{4}'.",
    "ms_date": "2026-10-01",
    "ms_topic": "reference",
    "search_form": [],
    "keywords": [],
    "ai_usage": null,
    "words": 75,
    "identifiers": []
  },
  "last_error": null,
  "retry_after": null,
  "output_hash": "42f5ff4acde42635fa1c86ed18de556807e4986d"
}
