{
  "id": "blog/duiliotacconi-com/2201",
  "pillar": "blog",
  "source": "duiliotacconi-com",
  "tier": "community",
  "title": "Debunking Myths related to Table Structure in Dynamics 365 Business Central 2026 Wave 2",
  "url": "https://duiliotacconi.com/2026/10/07/debunking-myths-related-to-table-structure-in-dynamics-365-business-central-2026-wave-2/",
  "published_at": "2026-10-07T13:14:06.000Z",
  "language": "en",
  "state": "published",
  "stages": {
    "discovered": {
      "at": "2026-10-07T18:11:38.258Z"
    },
    "fetched": {
      "at": "2026-10-07T18:12:10.927Z",
      "path": "vault:posts/duiliotacconi-com/2201.md",
      "words": 1438
    },
    "extracted": {
      "at": "2026-10-07T18:12:19.840Z",
      "prompt": "extract-post@1",
      "quotes": 3,
      "trimmed": 0,
      "cost_usd": 0.007023
    },
    "summarized": {
      "at": "2026-10-07T18:12:19.841Z",
      "from": "extract-post"
    },
    "linked": {
      "at": "2026-10-07T18:12:19.842Z"
    },
    "published": {
      "at": "2026-10-07T18:12:20.007Z",
      "path": "content/posts/duiliotacconi-com/2201.md"
    }
  },
  "input_hash": "2026-10-07T13:14:06.000Z",
  "attempts": 0,
  "flags": [],
  "last_error": null,
  "retry_after": null,
  "output_hash": "909b59e549bbcf04d1efc7fc3e4a47b0c6a29f085b85dbef0310cf5016c200da"
}
