{
  "id": "docs/learn-devitpro/dev-itpro/developer/methods-auto/testrequestpage/testrequestpage-previous-method.md",
  "pillar": "docs",
  "source": "learn-devitpro",
  "tier": "official",
  "title": "TestRequestPage.Previous() Method",
  "url": "https://learn.microsoft.com/dynamics365/business-central/dev-itpro/developer/methods-auto/testrequestpage/testrequestpage-previous-method",
  "published_at": "2026-10-07T12:07:15.000Z",
  "language": "en",
  "state": "fetched",
  "stages": {
    "discovered": {
      "at": "2026-10-06T11:15:53.411Z"
    },
    "fetched": {
      "at": "2026-10-07T18:13:16.878Z",
      "blob": "547b9294c6328c6c77f094872626296638a2f52f",
      "words": 100,
      "forms": 0
    }
  },
  "input_hash": "547b9294c6328c6c77f094872626296638a2f52f",
  "attempts": 0,
  "flags": [],
  "meta": {
    "repo": "MicrosoftDocs/dynamics365smb-devitpro-pb",
    "path": "dev-itpro/developer/methods-auto/testrequestpage/testrequestpage-previous-method.md",
    "description": "Sets the current row of the test page as the previous row in the data set.",
    "ms_date": "2026-10-01",
    "ms_topic": "reference",
    "search_form": [],
    "keywords": [],
    "ai_usage": null,
    "words": 100,
    "identifiers": []
  },
  "last_error": null,
  "retry_after": null,
  "output_hash": "547b9294c6328c6c77f094872626296638a2f52f"
}
