{
  "id": "docs/learn-devitpro/dev-itpro/api-reference/v2.0/api/dynamics_fixedasset_delete.md",
  "pillar": "docs",
  "source": "learn-devitpro",
  "tier": "official",
  "title": "Delete fixedAssets",
  "url": "https://learn.microsoft.com/dynamics365/business-central/dev-itpro/api-reference/v2.0/api/dynamics_fixedasset_delete",
  "published_at": "2026-08-24T07:56:13.000Z",
  "language": "en",
  "state": "published",
  "stages": {
    "discovered": {
      "at": "2026-10-06T11:15:53.411Z"
    },
    "fetched": {
      "at": "2026-10-06T12:26:20.625Z",
      "blob": "f6e7b1dd460c0a2cd9b5a3edc18a61514f5291d1",
      "words": 114,
      "forms": 0
    },
    "extracted": {
      "at": "2026-10-06T14:22:09.305Z",
      "prompt": "extract-docs@1",
      "parts": 1,
      "objects": 0,
      "cost_usd": 0.004833
    },
    "summarized": {
      "at": "2026-10-06T14:22:09.308Z",
      "from": "extract-docs"
    },
    "linked": {
      "at": "2026-10-06T14:22:09.308Z",
      "via": "topic hubs"
    },
    "published": {
      "at": "2026-10-06T14:22:09.308Z",
      "page": false
    }
  },
  "input_hash": "f6e7b1dd460c0a2cd9b5a3edc18a61514f5291d1",
  "attempts": 0,
  "flags": [],
  "meta": {
    "repo": "MicrosoftDocs/dynamics365smb-devitpro-pb",
    "path": "dev-itpro/api-reference/v2.0/api/dynamics_fixedasset_delete.md",
    "description": "Deletes a fixed asset object in Dynamics 365 Business Central.",
    "ms_date": "2026-08-21",
    "ms_topic": "how-to",
    "search_form": [],
    "keywords": [],
    "ai_usage": null,
    "words": 114,
    "identifiers": []
  },
  "last_error": null,
  "retry_after": null,
  "output_hash": "b6f5ec1fe293feab1de78620ae8c695bae95ae3255255e2074c246154d511e36"
}
