{
  "id": "docs/learn-devitpro/dev-itpro/developer/diagnostics/diagnostic-al585.md",
  "pillar": "docs",
  "source": "learn-devitpro",
  "tier": "official",
  "title": "Compiler Error AL0585",
  "url": "https://learn.microsoft.com/dynamics365/business-central/dev-itpro/developer/diagnostics/diagnostic-al585",
  "published_at": "2026-10-07T12:07:15.000Z",
  "language": "en",
  "state": "fetched",
  "stages": {
    "discovered": {
      "at": "2026-10-06T11:15:53.411Z"
    },
    "fetched": {
      "at": "2026-10-07T18:12:43.120Z",
      "blob": "83490ed07eb98d5148a31f44b53a7f68a3b28c11",
      "words": 46,
      "forms": 0
    }
  },
  "input_hash": "83490ed07eb98d5148a31f44b53a7f68a3b28c11",
  "attempts": 0,
  "flags": [],
  "meta": {
    "repo": "MicrosoftDocs/dynamics365smb-devitpro-pb",
    "path": "dev-itpro/developer/diagnostics/diagnostic-al585.md",
    "description": "An interface cannot have any variables.",
    "ms_date": "2026-10-01",
    "ms_topic": "reference",
    "search_form": [],
    "keywords": [],
    "ai_usage": null,
    "words": 46,
    "identifiers": [],
    "identifiers_rule": 2
  },
  "last_error": null,
  "retry_after": null,
  "output_hash": "83490ed07eb98d5148a31f44b53a7f68a3b28c11"
}
