{
  "id": "docs/learn-devitpro/dev-itpro/developer/devenv-rad-publishing.md",
  "pillar": "docs",
  "source": "learn-devitpro",
  "tier": "official",
  "title": "Work with Rapid Application Development",
  "url": "https://learn.microsoft.com/dynamics365/business-central/dev-itpro/developer/devenv-rad-publishing",
  "published_at": "2025-07-01T11:29:57.000Z",
  "language": "en",
  "state": "published",
  "stages": {
    "discovered": {
      "at": "2026-10-06T11:15:53.411Z"
    },
    "fetched": {
      "at": "2026-10-06T12:26:36.118Z",
      "blob": "974841b7bc4308123d33c6010b4ef0ced0dbd978",
      "words": 441,
      "forms": 0
    },
    "extracted": {
      "at": "2026-10-06T19:21:28.601Z",
      "prompt": "extract-docs@1",
      "parts": 1,
      "objects": 0,
      "cost_usd": 0.002622
    },
    "summarized": {
      "at": "2026-10-06T19:21:28.670Z",
      "from": "extract-docs"
    },
    "linked": {
      "at": "2026-10-06T19:21:28.672Z",
      "via": "topic hubs"
    },
    "published": {
      "at": "2026-10-06T19:21:28.680Z",
      "page": false
    }
  },
  "input_hash": "974841b7bc4308123d33c6010b4ef0ced0dbd978",
  "attempts": 0,
  "flags": [],
  "meta": {
    "repo": "MicrosoftDocs/dynamics365smb-devitpro-pb",
    "path": "dev-itpro/developer/devenv-rad-publishing.md",
    "description": "Describes what Rapid Application Development is and how you publish using RAD.",
    "ms_date": "2025-07-01",
    "ms_topic": "article",
    "search_form": [],
    "keywords": [],
    "ai_usage": null,
    "words": 441,
    "identifiers": [],
    "identifiers_rule": 2
  },
  "last_error": null,
  "retry_after": null,
  "output_hash": "ca72202346701e5329b93be44d4ad361d115ef8c4ed49e7a1cb431e9cae65dbc"
}
