{
  "id": "docs/learn-devitpro/dev-itpro/developer/methods-auto/xmlattribute/xmlattribute-writeto-xmlwriteoptions-outstream-method.md",
  "pillar": "docs",
  "source": "learn-devitpro",
  "tier": "official",
  "title": "XmlAttribute.WriteTo(XmlWriteOptions, OutStream) Method",
  "url": "https://learn.microsoft.com/dynamics365/business-central/dev-itpro/developer/methods-auto/xmlattribute/xmlattribute-writeto-xmlwriteoptions-outstream-method",
  "published_at": "2026-10-07T12:07:15.000Z",
  "language": "en",
  "state": "fetched",
  "stages": {
    "discovered": {
      "at": "2026-10-06T11:15:53.411Z"
    },
    "fetched": {
      "at": "2026-10-07T18:13:19.761Z",
      "blob": "269d7888766403adfe4cf8aee1ce847772b4a178",
      "words": 134,
      "forms": 0
    }
  },
  "input_hash": "269d7888766403adfe4cf8aee1ce847772b4a178",
  "attempts": 0,
  "flags": [],
  "meta": {
    "repo": "MicrosoftDocs/dynamics365smb-devitpro-pb",
    "path": "dev-itpro/developer/methods-auto/xmlattribute/xmlattribute-writeto-xmlwriteoptions-outstream-method.md",
    "description": "Serializes and saves the current node to the given variable.",
    "ms_date": "2026-10-01",
    "ms_topic": "reference",
    "search_form": [],
    "keywords": [],
    "ai_usage": null,
    "words": 134,
    "identifiers": []
  },
  "last_error": null,
  "retry_after": null,
  "output_hash": "269d7888766403adfe4cf8aee1ce847772b4a178"
}
