{
  "id": "guidelines/bcquality/microsoft/knowledge/data-modeling/owning-table-must-delete-dependents-in-ondelete.md",
  "pillar": "guidelines",
  "source": "bcquality",
  "tier": "official",
  "title": "A table that owns dependent records must delete them in `OnDelete`",
  "url": "https://github.com/microsoft/BCQuality/blob/main/microsoft/knowledge/data-modeling/owning-table-must-delete-dependents-in-ondelete.md",
  "published_at": "2026-09-09T15:31:03.000Z",
  "language": "en",
  "state": "published",
  "stages": {
    "discovered": {
      "at": "2026-10-06T11:15:53.411Z"
    },
    "fetched": {
      "at": "2026-10-29T21:28:24.596Z",
      "blob": "5ded169e53e08713963cd89a059d3ebe1ea74c36",
      "words": 324,
      "forms": 0
    },
    "published": {
      "at": "2026-10-29T21:28:24.903Z",
      "path": "content/guidelines/microsoft/knowledge/data-modeling/owning-table-must-delete-dependents-in-ondelete.md"
    }
  },
  "input_hash": "5ded169e53e08713963cd89a059d3ebe1ea74c36",
  "attempts": 0,
  "flags": [],
  "meta": {
    "repo": "microsoft/BCQuality",
    "path": "microsoft/knowledge/data-modeling/owning-table-must-delete-dependents-in-ondelete.md",
    "description": "TableRelation looks like referential integrity but only performs lookup and input validation. AL has no cascading delete: deleting a parent record leaves every dependent row untouched, and no error is raised.",
    "ms_date": null,
    "ms_topic": null,
    "search_form": [],
    "keywords": [
      "ondelete",
      "cascade",
      "table-relation",
      "orphan-records",
      "header-line",
      "dependent-records",
      "referential-integrity"
    ],
    "ai_usage": null,
    "words": 324,
    "identifiers": [
      "OnDelete",
      "TableRelation",
      "SystemMetadata"
    ],
    "identifiers_rule": 2,
    "bcq": {
      "domain": "data-modeling",
      "keywords": [
        "ondelete",
        "cascade",
        "table-relation",
        "orphan-records",
        "header-line",
        "dependent-records",
        "referential-integrity"
      ],
      "bc_version": [
        "all"
      ],
      "technologies": [
        "al"
      ],
      "countries": [
        "w1"
      ],
      "application_area": [
        "all"
      ],
      "kind": "rule",
      "summary": "TableRelation looks like referential integrity but only performs lookup and input validation. AL has no cascading delete: deleting a parent record leaves every dependent row untouched, and no error is raised."
    },
    "bcq_rule": 1
  },
  "last_error": null,
  "retry_after": null,
  "output_hash": "5ded169e53e08713963cd89a059d3ebe1ea74c36"
}
