{
  "id": "release/al-language-extension/al-18.1",
  "pillar": "release",
  "source": "al-language-extension",
  "tier": "official",
  "title": "AL Language extension 18.1",
  "url": "https://marketplace.visualstudio.com/items/ms-dynamics-smb.al/changelog",
  "published_at": "2026-10-10T00:00:00.000Z",
  "state": "published",
  "stages": {
    "discovered": {
      "at": "2026-10-11T00:26:06.897Z"
    },
    "fetched": {
      "at": "2026-10-11T00:26:29.352Z",
      "from": "snapshot"
    },
    "published": {
      "at": "2026-10-11T00:26:29.514Z",
      "path": "content/releases/al-18.1.md"
    }
  },
  "input_hash": "3dc93044fa8ee31a155517409a25183c2d16fc3d646ae445bc9030af61a0d417",
  "attempts": 0,
  "flags": [],
  "meta": {
    "version": "18.1",
    "wave": "2026 release wave 2",
    "major": "29",
    "preview_at": null,
    "released_at": "2026-10-10",
    "prerelease": false,
    "entries": 2
  },
  "last_error": null,
  "retry_after": null,
  "output_hash": "3dc93044fa8ee31a155517409a25183c2d16fc3d646ae445bc9030af61a0d417"
}
