{
  "id": "guidelines/alguidelines/content/docs/BestPractices/SetLoadFields/Index.md",
  "pillar": "guidelines",
  "source": "alguidelines",
  "tier": "official",
  "title": "Index",
  "url": "https://github.com/microsoft/alguidelines/blob/main/content/docs/BestPractices/SetLoadFields/Index.md",
  "published_at": "2023-09-22T11:01:23.000Z",
  "language": "en",
  "state": "skipped",
  "stages": {
    "discovered": {
      "at": "2026-10-06T11:15:53.411Z"
    }
  },
  "input_hash": "e3aae546bb933d215c63f996dd0b0a13201f0620",
  "attempts": 0,
  "flags": [],
  "meta": {
    "repo": "microsoft/alguidelines",
    "path": "content/docs/BestPractices/SetLoadFields/Index.md"
  },
  "skip": "links-only",
  "retry_after": null
}
